{
 "eval_id": "SE-20260812",
 "retailer": "partscat",
 "sector": "heavy-duty",
 "captured_via": "browser_dom",
 "rubric_hash": "99a0e992a992",
 "judge": "llama3.2:3b",
 "brand_color": "#FFCD11",
 "brand_ink": "#231f20",
 "headline": "Exact Cat part numbers redirect to the product (works); competitor cross-references return zero — a measured ~$64M/yr coverage gap.",
 "verdict": "Known-item search is strong for Cat's own numbers (they redirect to the product), but the site does NOT cross-reference competitor part numbers — WIX/Baldwin/Fleetguard/Donaldson equivalents return 0 results (0/19 in the top-25 by demand). Anchored to ~$5.5B online parts sales, that is ~$34M–$110M/yr recoverable (mid ~$64M). Secondary gaps: use-case queries return accessories; model-qualified queries ignore the machine model.",
 "stores": {
  "CP": {
   "id": "partscat",
   "name": "Cat Parts Store",
   "platform": "WebSphere / HCL Commerce"
  }
 },
 "datasets": [
  {
   "id": "synonym",
   "name": "Synonym / category",
   "terms": 5,
   "zero": 0,
   "coverage_pct": 100,
   "mean_ndcg": 0.94,
   "mean_grade": 2.22,
   "pct_not_relevant": 6,
   "shallow": 0,
   "has_keys": false,
   "mean_recall": null,
   "key_coverage_pct": 0
  },
  {
   "id": "attribute",
   "name": "Attribute (feature+material)",
   "terms": 2,
   "zero": 1,
   "coverage_pct": 50,
   "mean_ndcg": null,
   "mean_grade": 2.56,
   "pct_not_relevant": 11,
   "shallow": 0,
   "has_keys": false,
   "mean_recall": null,
   "key_coverage_pct": 0
  },
  {
   "id": "part_number",
   "name": "Part number (known-item)",
   "terms": 4,
   "zero": 0,
   "coverage_pct": 100,
   "mean_ndcg": null,
   "mean_grade": null,
   "pct_not_relevant": null,
   "shallow": 0,
   "has_keys": false,
   "mean_recall": null,
   "key_coverage_pct": 0
  },
  {
   "id": "intent",
   "name": "Intent / natural language",
   "terms": 3,
   "zero": 1,
   "coverage_pct": 67,
   "mean_ndcg": 1,
   "mean_grade": 1.89,
   "pct_not_relevant": 16,
   "shallow": 0,
   "has_keys": false,
   "mean_recall": null,
   "key_coverage_pct": 0
  },
  {
   "id": "job_function",
   "name": "Job-function (use case)",
   "terms": 1,
   "zero": 0,
   "coverage_pct": 100,
   "mean_ndcg": 0.78,
   "mean_grade": 1,
   "pct_not_relevant": 90,
   "shallow": 1,
   "has_keys": false,
   "mean_recall": null,
   "key_coverage_pct": 0
  },
  {
   "id": "cat-crossref-1to1",
   "name": "CAT xref — one-to-one",
   "terms": 25,
   "zero": 19,
   "coverage_pct": 24,
   "mean_grade": 0.72,
   "pct_not_relevant": null,
   "shallow": 0,
   "has_keys": false,
   "mean_recall": null,
   "key_coverage_pct": 0,
   "custom": true,
   "custom_type": "one_to_one",
   "built_from": "Strict 1-1 Caterpillar filter cross-reference set. Each record is one search term -> the one Caterpillar product it should retrieve. Terms are the Cat part number itself plus each equivalent competitor number (Baldwin, Fleetguard, Donaldson, WIX, Fram), so searching any equivalent on the Cat site is expected to return the same Cat product. Two evidenced sources: (1) Baldwin Filters interchange PDF (Cat-tagged rows; titles inferred from Baldwin prefixes and flagged for verification), (2) per-filter Caterpillar cross-reference pages on industrialstop.com for popular 1R-series filters (authoritative Cat titles). Interchanges capped at 25 per Cat part; duplicate terms deduped to preserve strict 1-1. monthly_volume is null pending a demand capture. The Baldwin term 'B99' is excluded: its search volume is contaminated by the unrelated TV show 'Brooklyn Nine-Nine' and does not reflect filter demand.",
   "rollup": {
    "records": 25,
    "scored": 25,
    "not_found": 19,
    "found_first": 6,
    "found_any": 6,
    "pct_not_found": 76,
    "mean_score": 0.72,
    "cross_ref_resolve": "0/19",
    "cat_resolve": "6/6"
   }
  }
 ],
 "rows": [
  {
   "dataset": "synonym",
   "q": "heavy duty battery",
   "total": 132,
   "search_call": "https://parts.cat.com/en/catcorp/search?q=heavy%20duty%20battery&p_page=1",
   "items": [
    "153-5720: Heavy Duty Battery",
    "9X-9730: 12V Heavy Duty Low Maintenance Battery",
    "9X-3404: 12V Heavy Duty Maintenance-Free Battery",
    "115-2422: 12V Heavy Duty Maintenance-Free Battery",
    "9X-9720: 12V Heavy Duty Low Maintenance Battery",
    "101-4000: 12V Heavy Duty Low Maintenance Battery",
    "175-4370: 12V Heavy Duty Maintenance-Free Battery",
    "153-5710: 12V Heavy Duty Maintenance-Free Battery",
    "399-2842: Cable Assembly-Battery",
    "300-6152: Cable Assembly-Battery"
   ],
   "item_skus": [
    "153-5720",
    "9X-9730",
    "9X-3404",
    "115-2422",
    "9X-9720",
    "101-4000",
    "175-4370",
    "153-5710",
    "399-2842",
    "300-6152"
   ],
   "grades": [
    3,
    3,
    3,
    3,
    3,
    3,
    3,
    2,
    1
   ],
   "ndcg": null,
   "mean_grade": 2.67,
   "recall": null,
   "source": "catalog_node",
   "zero": false,
   "redirected": false,
   "classification": null,
   "verified": null
  },
  {
   "dataset": "synonym",
   "q": "oil filter",
   "total": 16,
   "search_call": "https://parts.cat.com/en/catcorp/search?q=oil%20filter&p_page=1",
   "items": [
    "7W-2326: Engine Oil Filter",
    "1R-1808: Engine Oil Filter",
    "500-0483: Engine Oil Filter",
    "462-1171: Standard Efficiency Engine Oil Filter",
    "1R-1807: Advanced Efficiency Engine Oil Filter",
    "377-6969: Standard Efficiency Engine Oil Filter",
    "249-2347: Advanced Efficiency Engine Oil Filter",
    "569-8036: Lube Filter Element Kit (Engine Oil)",
    "094-7207: Engine Oil Filter",
    "2P-4301: Base-Oil Filter"
   ],
   "item_skus": [
    "7W-2326",
    "1R-1808",
    "500-0483",
    "462-1171",
    "1R-1807",
    "377-6969",
    "249-2347",
    "569-8036",
    "094-7207",
    "2P-4301"
   ],
   "grades": [
    2,
    2,
    2,
    2,
    2,
    2,
    2,
    2,
    2,
    3
   ],
   "ndcg": 0.8387049725241668,
   "mean_grade": 2.1,
   "recall": null,
   "source": "catalog_node",
   "zero": false,
   "redirected": false,
   "classification": null,
   "verified": null
  },
  {
   "dataset": "synonym",
   "q": "bucket teeth",
   "total": 16,
   "search_call": "https://parts.cat.com/en/catcorp/search?q=bucket%20teeth&p_page=1",
   "items": [
    "1U-3202: Bucket Tip",
    "220-9090: K Series Tip Retainer",
    "1U-3302: Bucket Tip",
    "6Y-3222: Bucket Tip",
    "135-8203: Uni-Tooth Bucket Tip",
    "505-4103: Bucket Tip",
    "475-5480: Bucket Tip",
    "505-4113: Bucket Tip",
    "5K-2925: Bucket Tooth Short Tip",
    "195-7206: Bucket Tip"
   ],
   "item_skus": [
    "1U-3202",
    "220-9090",
    "1U-3302",
    "6Y-3222",
    "135-8203",
    "505-4103",
    "475-5480",
    "505-4113",
    "5K-2925",
    "195-7206"
   ],
   "grades": [
    3,
    1,
    3,
    1,
    2,
    2,
    2,
    2,
    2,
    2
   ],
   "ndcg": 0.9226981151896108,
   "mean_grade": 2,
   "recall": null,
   "source": "catalog_node",
   "zero": false,
   "redirected": false,
   "classification": null,
   "verified": null
  },
  {
   "dataset": "synonym",
   "q": "cutting edge",
   "total": 16,
   "search_call": "https://parts.cat.com/en/catcorp/search?q=cutting%20edge&p_page=1",
   "items": [
    "525-5669: Center Cutting Edge",
    "494-5878: Bucket Cutting Edge",
    "593-0318: Bucket Cutting Edge",
    "523-9813: Bucket Cutting Edge",
    "593-0319: Bucket Cutting Edge",
    "522-6329: 1100mm Wide Reversible Level Cut Cutting Edge",
    "107-3746: Bucket Cutting Edge",
    "1U-0601: Bucket Cutting Edge",
    "135-9666: Bucket Cutting Edge",
    "132-4724: Bucket Cutting Edge"
   ],
   "item_skus": [
    "525-5669",
    "494-5878",
    "593-0318",
    "523-9813",
    "593-0319",
    "522-6329",
    "107-3746",
    "1U-0601",
    "135-9666",
    "132-4724"
   ],
   "grades": [
    2,
    2,
    2,
    2,
    2,
    2,
    2,
    2,
    2,
    2
   ],
   "ndcg": 1,
   "mean_grade": 2,
   "recall": null,
   "source": "catalog_node",
   "zero": false,
   "redirected": false,
   "classification": null,
   "verified": null
  },
  {
   "dataset": "synonym",
   "q": "general duty battery",
   "total": 150,
   "search_call": "https://parts.cat.com/en/catcorp/search?q=general%20duty%20battery&p_page=1",
   "items": [
    "593-3129: General Duty Wet Battery",
    "242-0825: General Duty, Wet, Battery",
    "570-6511: General Duty Wet Battery",
    "593-3128: General Duty Wet Battery",
    "563-6052: 12V General Duty Battery",
    "3T-5857: 12V General Duty Maintenance-Free Battery",
    "356-6214: 12V T7 BCI Battery",
    "8C-3605: 12V 41 BCI Battery",
    "570-6509: Battery-Wet-Gd",
    "8C-3628: 12V General Duty Maintenance-Free Battery"
   ],
   "item_skus": [
    "593-3129",
    "242-0825",
    "570-6511",
    "593-3128",
    "563-6052",
    "3T-5857",
    "356-6214",
    "8C-3605",
    "570-6509",
    "8C-3628"
   ],
   "grades": [
    3,
    3,
    2,
    3,
    3,
    2,
    2,
    2,
    2,
    2
   ],
   "ndcg": 0.9810450720877845,
   "mean_grade": 2.4,
   "recall": null,
   "source": "catalog_node",
   "zero": false,
   "redirected": false,
   "classification": null,
   "verified": null
  },
  {
   "dataset": "attribute",
   "q": "12 volt battery",
   "total": 261,
   "search_call": "https://parts.cat.com/en/catcorp/search?q=12%20volt%20battery&p_page=1",
   "items": [
    "242-0825: General Duty, Wet, Battery",
    "8C-3601: 12V 27 BCI Battery",
    "430-5996: 12V General Duty Maintenance-Free Battery",
    "430-5992: 12V 24DC BCI Battery",
    "483-8978: 12 Volt Battery",
    "563-6052: 12V General Duty Battery",
    "250-0476: 12 Volt High-Rate UPS Battery",
    "175-4390: 12V 31 BCI Battery",
    "154-3630: 12 Volt Control Timer",
    "369-9955: 12V DIN C11 Battery"
   ],
   "item_skus": [
    "242-0825",
    "8C-3601",
    "430-5996",
    "430-5992",
    "483-8978",
    "563-6052",
    "250-0476",
    "175-4390",
    "154-3630",
    "369-9955"
   ],
   "grades": [
    2,
    2,
    3,
    1,
    3,
    3,
    3,
    3,
    3
   ],
   "ndcg": null,